{
  "$schema": "product-truth-v1.schema.json",
  "schema_version": "1",
  "contract_id": "agtoosa.product-truth",
  "contract_version": "1.0.0",
  "static_claim_boundary": {
    "allowed": [
      "declared-static-conformance",
      "claim-freshness"
    ],
    "forbidden": [
      "host-recognition",
      "scenario-tested-behavior",
      "authenticated-provenance",
      "native-sandboxing",
      "full-powershell-parity",
      "universal-assistant-support"
    ]
  },
  "path_policy": {
    "id": "path-policy",
    "generated_root": "template",
    "installed_root": "Docs",
    "candidate_files": [
      "template/Docs/AgToosa_Agent.md",
      "template/Docs/AgToosa_Build.md",
      "template/Docs/AgToosa_CrossModelReview.md",
      "template/Docs/AgToosa_Dashboard.md",
      "template/Docs/AgToosa_GovernancePolicy.md",
      "template/Docs/AgToosa_MetricsKit.md",
      "template/Docs/AgToosa_Network_Matrix.md",
      "template/Docs/AgToosa_Orchestration.md",
      "template/Docs/AgToosa_Readiness.md",
      "template/Docs/AgToosa_Registry.md",
      "template/Docs/AgToosa_Retro.md",
      "template/Docs/AgToosa_Review.md",
      "template/Docs/AgToosa_Ship.md",
      "template/Docs/AgToosa_Spec.md",
      "template/Docs/AgToosa_Update.md",
      "template/Docs/SPEC-FORMAT.md",
      "template/Docs/agtoosa-dashboard.sh",
      "template/Docs/agtoosa-gate.yml.example",
      "template/Docs/agtoosa-policy-check.sh",
      "template/Docs/agtoosa-verify.sh"
    ],
    "max_file_bytes": 1048576,
    "max_entries": 4096,
    "max_string_bytes": 4096,
    "exemptions": [
      {
        "id": "path.remote-url",
        "kind": "remote-url",
        "paths": [
          "template/Docs/**"
        ],
        "owner": "DEV-118",
        "reason": "Remote URL paths preserve the publisher's canonical lowercase path."
      },
      {
        "id": "path.dual-root",
        "kind": "dual-root-resolver",
        "paths": [
          "template/Docs/agtoosa-dashboard.sh",
          "template/Docs/agtoosa-gate.yml.example",
          "template/Docs/agtoosa-policy-check.sh",
          "template/Docs/agtoosa-verify.sh"
        ],
        "owner": "DEV-118",
        "reason": "Installed and maintainer mirrors intentionally probe both Docs/ and docs/ roots."
      },
      {
        "id": "path.maintainer-text",
        "kind": "maintainer-dogfood",
        "paths": [
          "template/Docs/AgToosa_Agent.md",
          "template/Docs/AgToosa_Network_Matrix.md",
          "template/Docs/AgToosa_Readiness.md",
          "template/Docs/AgToosa_GovernancePolicy.md",
          "template/Docs/AgToosa_Registry.md",
          "template/Docs/AgToosa_Retro.md",
          "template/Docs/AgToosa_Update.md"
        ],
        "owner": "DEV-118",
        "reason": "Explicit maintainer-only examples name the lowercase source-repository root."
      }
    ]
  },
  "commands": [
    {
      "id": "command.build",
      "phase": "build",
      "invocation": "/agtoosa-build",
      "modes": [
        "full",
        "tdd",
        "test",
        "handoff",
        "import"
      ],
      "canonical_workflow": "Docs/AgToosa_Build.md",
      "operating_context": "generated-project",
      "question_budget": {
        "max_questions": 0,
        "quick_max": 0
      },
      "mutation_class": "write",
      "approval_gate": false,
      "phase_stop": true,
      "lifecycle_close": "review",
      "state_reads": [
        "Docs/Master-Plan.md"
      ],
      "state_writes": [
        "Docs/Master-Plan.md"
      ],
      "side_effects": [
        "repository-files"
      ],
      "dependencies": [],
      "failure_policy": "fail-closed-on-prerequisite-or-approval-gap",
      "portable_invariants": [
        "route:Docs/AgToosa_Build.md",
        "invocation:/agtoosa-build",
        "mutation:write"
      ]
    },
    {
      "id": "command.catalog",
      "phase": "utility",
      "invocation": "/agtoosa-catalog",
      "modes": [
        "full",
        "list",
        "search",
        "info",
        "validate"
      ],
      "canonical_workflow": "Docs/AgToosa_Catalog.md",
      "operating_context": "generated-project",
      "question_budget": {
        "max_questions": 0,
        "quick_max": 0
      },
      "mutation_class": "read-only",
      "approval_gate": false,
      "phase_stop": false,
      "lifecycle_close": "none",
      "state_reads": [
        "Docs/Master-Plan.md"
      ],
      "state_writes": [],
      "side_effects": [],
      "dependencies": [],
      "failure_policy": "fail-closed-on-prerequisite-or-approval-gap",
      "portable_invariants": [
        "route:Docs/AgToosa_Catalog.md",
        "invocation:/agtoosa-catalog",
        "mutation:read-only"
      ]
    },
    {
      "id": "command.concise",
      "phase": "utility",
      "invocation": "/agtoosa-concise",
      "modes": [
        "full"
      ],
      "canonical_workflow": "Docs/AgToosa_Concise.md",
      "operating_context": "generated-project",
      "question_budget": {
        "max_questions": 0,
        "quick_max": 0
      },
      "mutation_class": "read-only",
      "approval_gate": false,
      "phase_stop": false,
      "lifecycle_close": "none",
      "state_reads": [
        "Docs/Master-Plan.md"
      ],
      "state_writes": [],
      "side_effects": [],
      "dependencies": [],
      "failure_policy": "fail-closed-on-prerequisite-or-approval-gap",
      "portable_invariants": [
        "route:Docs/AgToosa_Concise.md",
        "invocation:/agtoosa-concise",
        "mutation:read-only"
      ]
    },
    {
      "id": "command.debug",
      "phase": "review",
      "invocation": "/agtoosa-debug",
      "modes": [
        "full"
      ],
      "canonical_workflow": "Docs/AgToosa_Debug.md",
      "operating_context": "generated-project",
      "question_budget": {
        "max_questions": 0,
        "quick_max": 0
      },
      "mutation_class": "read-only",
      "approval_gate": false,
      "phase_stop": false,
      "lifecycle_close": "none",
      "state_reads": [
        "Docs/Master-Plan.md"
      ],
      "state_writes": [],
      "side_effects": [],
      "dependencies": [],
      "failure_policy": "fail-closed-on-prerequisite-or-approval-gap",
      "portable_invariants": [
        "route:Docs/AgToosa_Debug.md",
        "invocation:/agtoosa-debug",
        "mutation:read-only"
      ]
    },
    {
      "id": "command.evidence",
      "phase": "review",
      "invocation": "/agtoosa-evidence",
      "modes": [
        "full",
        "review",
        "ship"
      ],
      "canonical_workflow": "Docs/AgToosa_Evidence.md",
      "operating_context": "generated-project",
      "question_budget": {
        "max_questions": 0,
        "quick_max": 0
      },
      "mutation_class": "write",
      "approval_gate": false,
      "phase_stop": false,
      "lifecycle_close": "none",
      "state_reads": [
        "Docs/Master-Plan.md"
      ],
      "state_writes": [
        "Docs/Master-Plan.md"
      ],
      "side_effects": [
        "repository-files"
      ],
      "dependencies": [],
      "failure_policy": "fail-closed-on-prerequisite-or-approval-gap",
      "portable_invariants": [
        "route:Docs/AgToosa_Evidence.md",
        "invocation:/agtoosa-evidence",
        "mutation:write"
      ]
    },
    {
      "id": "command.goal",
      "phase": "spec",
      "invocation": "/agtoosa-goal",
      "modes": [
        "full",
        "check"
      ],
      "canonical_workflow": "Docs/AgToosa_Goal.md",
      "operating_context": "generated-project",
      "question_budget": {
        "max_questions": 12,
        "quick_max": 0
      },
      "mutation_class": "mixed",
      "approval_gate": true,
      "phase_stop": false,
      "lifecycle_close": "none",
      "state_reads": [
        "Docs/Master-Plan.md"
      ],
      "state_writes": [
        "Docs/Master-Plan.md"
      ],
      "side_effects": [
        "repository-files"
      ],
      "dependencies": [],
      "failure_policy": "fail-closed-on-prerequisite-or-approval-gap",
      "portable_invariants": [
        "route:Docs/AgToosa_Goal.md",
        "invocation:/agtoosa-goal",
        "mutation:mixed"
      ]
    },
    {
      "id": "command.handoff",
      "phase": "build",
      "invocation": "/agtoosa-handoff",
      "modes": [
        "full",
        "wave",
        "task"
      ],
      "canonical_workflow": "Docs/AgToosa_Handoff.md",
      "operating_context": "generated-project",
      "question_budget": {
        "max_questions": 0,
        "quick_max": 0
      },
      "mutation_class": "write",
      "approval_gate": false,
      "phase_stop": false,
      "lifecycle_close": "none",
      "state_reads": [
        "Docs/Master-Plan.md"
      ],
      "state_writes": [
        "Docs/Master-Plan.md"
      ],
      "side_effects": [
        "repository-files"
      ],
      "dependencies": [],
      "failure_policy": "fail-closed-on-prerequisite-or-approval-gap",
      "portable_invariants": [
        "route:Docs/AgToosa_Handoff.md",
        "invocation:/agtoosa-handoff",
        "mutation:write"
      ]
    },
    {
      "id": "command.help",
      "phase": "utility",
      "invocation": "/agtoosa-help",
      "modes": [
        "full",
        "next"
      ],
      "canonical_workflow": "Docs/AgToosa_Agent.md",
      "operating_context": "generated-project",
      "question_budget": {
        "max_questions": 0,
        "quick_max": 0
      },
      "mutation_class": "read-only",
      "approval_gate": false,
      "phase_stop": false,
      "lifecycle_close": "none",
      "state_reads": [
        "Docs/Master-Plan.md"
      ],
      "state_writes": [],
      "side_effects": [],
      "dependencies": [],
      "failure_policy": "fail-closed-on-prerequisite-or-approval-gap",
      "portable_invariants": [
        "route:Docs/AgToosa_Agent.md",
        "invocation:/agtoosa-help",
        "mutation:read-only"
      ]
    },
    {
      "id": "command.next",